09:15:45.595344 IP 192.168.20.65.58085 > 239.255.255.250.1900: UDP, length 167
09:15:46.595913 IP 192.168.20.65.58085 > 239.255.255.250.1900: UDP, length 167
09:15:47.596106 IP 192.168.20.65.58085 > 239.255.255.250.1900: UDP, length 167
09:15:48.596420 IP 192.168.20.65.58085 > 239.255.255.250.1900: UDP, length 167
09:16:35.764557 IP 192.168.20.250.138 > 192.168.20.255.138: NBT UDP PACKET(138)
09:16:38.413562 IP 192.168.20.250 > 224.0.0.1: igmp query v3
09:16:38.802115 IP 192.168.20.63 > 224.0.0.22: igmp v3 report, 1 group record(s)
09:16:40.304527 IP 192.168.20.63 > 224.0.0.22: igmp v3 report, 1 group record(s)
09:16:40.665765 IP 192.168.20.62 > 224.0.0.22: igmp v3 report, 2 group record(s)
09:16:41.486487 IP 192.168.20.66 > 224.0.0.22: igmp v3 report, 2 group record(s)
09:16:41.842431 IP 192.168.20.63.56626 > 239.255.255.250.1900: UDP, length 174
09:16:42.009414 IP 192.168.20.65 > 224.0.0.22: igmp v3 report, 2 group record(s)
09:16:42.149388 IP 192.168.20.44 > 224.0.0.22: igmp v3 report, 1 group record(s)
09:16:42.842870 IP 192.168.20.63.56626 > 239.255.255.250.1900: UDP, length 174
09:16:43.083340 IP 192.168.20.60 > 224.0.0.22: igmp v3 report, 2 group record(s)
09:16:43.845297 IP 192.168.20.63.56626 > 239.255.255.250.1900: UDP, length 174
09:16:44.552129 IP 192.168.20.51 > 224.0.0.22: igmp v3 report, 2 group record(s)
09:16:44.745005 IP 192.168.20.56 > 224.0.0.22: igmp v3 report, 2 group record(s)
09:16:44.858717 IP 192.168.20.63.56626 > 239.255.255.250.1900: UDP, length 174
09:16:45.312852 IP 192.168.20.63 > 224.0.0.22: igmp v3 report, 1 group record(s)
09:16:45.649605 IP 192.168.20.44 > 224.0.0.22: igmp v3 report, 2 group record(s)
09:16:45.866357 IP 192.168.20.79 > 224.0.0.22: igmp v3 report, 1 group record(s)
09:16:45.969206 IP 192.168.20.52 > 224.0.0.22: igmp v3 report, 2 group record(s)
09:16:46.366095 IP 192.168.20.79 > 224.0.0.22: igmp v3 report, 1 group record(s)
09:16:46.526552 IP 192.168.20.54 > 224.0.0.22: igmp v3 report, 2 group record(s)
09:16:46.809821 IP 192.168.20.55 > 224.0.0.22: igmp v3 report, 2 group record(s)
09:16:47.866179 IP 192.168.20.79 > 224.0.0.22: igmp v3 report, 1 group record(s)
09:17:28.622319 IP 192.168.20.63.55256 > 224.0.0.252.5355: UDP, length 22
09:17:28.722142 IP 192.168.20.63.55256 > 224.0.0.252.5355: UDP, length 22
09:17:28.928008 IP 192.168.20.63.137 > 192.168.20.255.137: NBT UDP PACKET(137): QUERY; REQUEST; BROADCAST
09:17:29.677236 IP 192.168.20.63.137 > 192.168.20.255.137: NBT UDP PACKET(137): QUERY; REQUEST; BROADCAST
09:17:30.427339 IP 192.168.20.63.137 > 192.168.20.255.137: NBT UDP PACKET(137): QUERY; REQUEST; BROADCAST
09:17:45.595398 IP 192.168.20.65.46466 > 239.255.255.250.1900: UDP, length 167
09:17:46.596289 IP 192.168.20.65.46466 > 239.255.255.250.1900: UDP, length 167
09:17:47.596670 IP 192.168.20.65.46466 > 239.255.255.250.1900: UDP, length 167
09:17:48.597248 IP 192.168.20.65.46466 > 239.255.255.250.1900: UDP, length 167
09:18:14.822740 IP 192.168.20.77.57621 > 255.255.255.255.57621: UDP, length 40
09:18:32.036099 IP 192.168.20.74.5353 > 224.0.0.251.5353: 0 [2q] [1au] PTR (QU)? _homekit._tcp.local. PTR (QU)? _sleep-proxy._udp.local. (90)
09:18:33.041193 IP 192.168.20.74.5353 > 224.0.0.251.5353: 0 [2q] [1au] PTR (QM)? _homekit._tcp.local. PTR (QM)? _sleep-proxy._udp.local. (90)
09:18:36.050612 IP 192.168.20.74.5353 > 224.0.0.251.5353: 0 [2q] [1au] PTR (QM)? _homekit._tcp.local. PTR (QM)? _sleep-proxy._udp.local. (90)
09:18:36.573728 IP 192.168.20.77.57621 > 255.255.255.255.57621: UDP, length 40
09:18:36.742116 IP 192.168.20.77.5353 > 224.0.0.251.5353: 1 [2q] PTR (QU)? _CC32E753._sub._googlecast._tcp.local. PTR (QU)? _googlecast._tcp.local. (61)
09:18:36.744934 IP 192.168.20.77.5353 > 224.0.0.251.5353: 1 [2q] PTR (QU)? _CC32E753._sub._googlecast._tcp.local. PTR (QU)? _googlecast._tcp.local. (61)
09:18:36.886199 IP 192.168.20.77 > 224.0.0.22: igmp v3 report, 1 group record(s)
09:18:36.886358 IP 192.168.20.77 > 224.0.0.22: igmp v3 report, 1 group record(s)
09:18:36.888307 IP 192.168.20.77.39232 > 224.0.0.251.5353: 0 PTR (QU)? _spotify-connect._tcp.local. (45)
09:18:36.888325 IP 192.168.20.77.49191 > 239.255.255.250.1900: UDP, length 125
09:18:37.030449 IP 192.168.20.77 > 224.0.0.22: igmp v3 report, 1 group record(s)
09:18:37.815735 IP 192.168.20.77.5353 > 224.0.0.251.5353: 2 [2q] PTR (QM)? _CC32E753._sub._googlecast._tcp.local. PTR (QM)? _googlecast._tcp.local. (61)
09:18:38.759894 IP 192.168.20.77.5353 > 224.0.0.251.5353: 3 [2q] PTR (QM)? _CC32E753._sub._googlecast._tcp.local. PTR (QM)? _googlecast._tcp.local. (61)
09:18:38.948890 IP 192.168.20.77.39232 > 224.0.0.251.5353: 0 PTR (QU)? _spotify-connect._tcp.local. (45)
09:18:38.949208 IP 192.168.20.77.49191 > 239.255.255.250.1900: UDP, length 125
09:18:40.816746 IP 192.168.20.77.39232 > 224.0.0.251.5353: 0 PTR (QU)? _spotify-connect._tcp.local. (45)
09:18:40.818965 IP 192.168.20.77.49191 > 239.255.255.250.1900: UDP, length 125
09:18:41.848401 IP 192.168.20.63.57468 > 239.255.255.250.1900: UDP, length 174
09:18:42.818113 IP 192.168.20.77.39232 > 224.0.0.251.5353: 0 PTR (QU)? _spotify-connect._tcp.local. (45)
09:18:42.819718 IP 192.168.20.77.49191 > 239.255.255.250.1900: UDP, length 125
09:18:42.849495 IP 192.168.20.63.57468 > 239.255.255.250.1900: UDP, length 174
09:18:43.417885 IP 192.168.20.250 > 224.0.0.1: igmp query v3
09:18:43.810308 IP 192.168.20.63 > 224.0.0.22: igmp v3 report, 1 group record(s)
09:18:43.850550 IP 192.168.20.63.57468 > 239.255.255.250.1900: UDP, length 174
09:18:43.865008 IP 192.168.20.65 > 224.0.0.22: igmp v3 report, 2 group record(s)
09:18:44.149884 IP 192.168.20.44 > 224.0.0.22: igmp v3 report, 1 group record(s)
09:18:44.818790 IP 192.168.20.77.39232 > 224.0.0.251.5353: 0 PTR (QU)? _spotify-connect._tcp.local. (45)
09:18:44.822954 IP 192.168.20.77.49191 > 239.255.255.250.1900: UDP, length 125
09:18:44.850675 IP 192.168.20.63.57468 > 239.255.255.250.1900: UDP, length 174
09:18:44.878749 IP 192.168.20.79 > 224.0.0.22: igmp v3 report, 1 group record(s)
09:18:44.999728 IP 192.168.20.51 > 224.0.0.22: igmp v3 report, 2 group record(s)
09:18:45.079070 IP 192.168.20.74.5353 > 224.0.0.251.5353: 0 [2q] [1au] PTR (QM)? _homekit._tcp.local. PTR (QM)? _sleep-proxy._udp.local. (90)
09:18:46.105428 IP 192.168.20.62 > 224.0.0.22: igmp v3 report, 2 group record(s)
09:18:46.670401 IP 192.168.20.66 > 224.0.0.22: igmp v3 report, 2 group record(s)
09:18:46.877623 IP 192.168.20.77.39232 > 224.0.0.251.5353: 0 PTR (QU)? _spotify-connect._tcp.local. (45)
09:18:46.877952 IP 192.168.20.77.49191 > 239.255.255.250.1900: UDP, length 125
09:18:47.640728 IP 192.168.20.63.58395 > 239.255.255.250.1900: UDP, length 97
09:18:47.648886 IP 192.168.20.63.58395 > 239.255.255.250.1900: UDP, length 129
09:18:47.695073 IP 192.168.20.63.54917 > 239.255.255.250.3702: UDP, length 624
09:18:47.698448 IP 192.168.20.63.138 > 192.168.20.255.138: NBT UDP PACKET(138)
09:18:47.698463 IP 192.168.20.63.137 > 192.168.20.255.137: NBT UDP PACKET(137): QUERY; REQUEST; BROADCAST
09:18:47.785878 IP 192.168.20.63.54917 > 239.255.255.250.3702: UDP, length 624
09:18:48.081277 IP 192.168.20.52 > 224.0.0.22: igmp v3 report, 2 group record(s)
09:18:48.150107 IP 192.168.20.44 > 224.0.0.22: igmp v3 report, 1 group record(s)
09:18:48.447712 IP 192.168.20.63.137 > 192.168.20.255.137: NBT UDP PACKET(137): QUERY; REQUEST; BROADCAST
09:18:48.824608 IP 192.168.20.77.39232 > 224.0.0.251.5353: 0 PTR (QU)? _spotify-connect._tcp.local. (45)
09:18:48.824905 IP 192.168.20.77.49191 > 239.255.255.250.1900: UDP, length 125
09:18:48.866526 IP 192.168.20.79 > 224.0.0.22: igmp v3 report, 1 group record(s)
09:18:49.197784 IP 192.168.20.63.137 > 192.168.20.255.137: NBT UDP PACKET(137): QUERY; REQUEST; BROADCAST
09:18:49.547105 IP 192.168.20.60 > 224.0.0.22: igmp v3 report, 2 group record(s)
09:18:49.650133 IP 192.168.20.44 > 224.0.0.22: igmp v3 report, 1 group record(s)
09:18:49.921810 IP 192.168.20.54 > 224.0.0.22: igmp v3 report, 2 group record(s)
09:18:49.949687 IP 192.168.20.63.138 > 192.168.20.255.138: NBT UDP PACKET(138)
09:18:49.949700 IP 192.168.20.63.137 > 192.168.20.255.137: NBT UDP PACKET(137): QUERY; REQUEST; BROADCAST
09:18:50.641256 IP 192.168.20.63.58395 > 239.255.255.250.1900: UDP, length 97
09:18:50.649220 IP 192.168.20.63.58395 > 239.255.255.250.1900: UDP, length 129
09:18:50.698822 IP 192.168.20.63.137 > 192.168.20.255.137: NBT UDP PACKET(137): QUERY; REQUEST; BROADCAST
09:18:50.809884 IP 192.168.20.63 > 224.0.0.22: igmp v3 report, 1 group record(s)
09:18:50.822501 IP 192.168.20.77.39232 > 224.0.0.251.5353: 0 PTR (QU)? _spotify-connect._tcp.local. (45)
09:18:50.824499 IP 192.168.20.77.49191 > 239.255.255.250.1900: UDP, length 125
09:18:50.870541 IP 192.168.20.79 > 224.0.0.22: igmp v3 report, 1 group record(s)
09:18:51.209151 IP 192.168.20.56 > 224.0.0.22: igmp v3 report, 2 group record(s)
09:18:51.263904 IP 192.168.20.63.137 > 192.168.20.255.137: NBT UDP PACKET(137): QUERY; REQUEST; BROADCAST
09:18:51.448961 IP 192.168.20.63.137 > 192.168.20.255.137: NBT UDP PACKET(137): QUERY; REQUEST; BROADCAST
09:18:51.738911 IP 192.168.20.55 > 224.0.0.22: igmp v3 report, 2 group record(s)
09:18:52.013978 IP 192.168.20.63.137 > 192.168.20.255.137: NBT UDP PACKET(137): QUERY; REQUEST; BROADCAST
09:18:52.221219 IP 192.168.20.63.59158 > 224.0.0.252.5355: UDP, length 23
09:18:52.221843 IP 192.168.20.63.52391 > 224.0.0.252.5355: UDP, length 23
09:18:52.224244 IP 192.168.20.63.137 > 192.168.20.255.137: NBT UDP PACKET(137): QUERY; REQUEST; BROADCAST
09:18:52.341068 IP 192.168.20.63.58240 > 224.0.0.252.5355: UDP, length 23
09:18:52.341703 IP 192.168.20.63.56835 > 224.0.0.252.5355: UDP, length 23
09:18:52.358702 IP 192.168.20.63.62639 > 224.0.0.252.5355: UDP, length 23
09:18:52.359244 IP 192.168.20.63.55737 > 224.0.0.252.5355: UDP, length 23
09:18:52.764021 IP 192.168.20.63.137 > 192.168.20.255.137: NBT UDP PACKET(137): QUERY; REQUEST; BROADCAST
09:18:52.809987 IP 192.168.20.63 > 224.0.0.22: igmp v3 report, 1 group record(s)
09:18:52.824893 IP 192.168.20.77.49191 > 239.255.255.250.1900: UDP, length 125
09:18:52.824902 IP 192.168.20.77.39232 > 224.0.0.251.5353: 0 PTR (QU)? _spotify-connect._tcp.local. (45)
09:18:53.641441 IP 192.168.20.63.58395 > 239.255.255.250.1900: UDP, length 97
09:18:53.649438 IP 192.168.20.63.58395 > 239.255.255.250.1900: UDP, length 129
09:18:54.824377 IP 192.168.20.77.49191 > 239.255.255.250.1900: UDP, length 125
09:18:54.824391 IP 192.168.20.77.39232 > 224.0.0.251.5353: 0 PTR (QU)? _spotify-connect._tcp.local. (45)
09:18:56.825085 IP 192.168.20.77.39232 > 224.0.0.251.5353: 0 PTR (QU)? _spotify-connect._tcp.local. (45)
09:18:56.825415 IP 192.168.20.77.49191 > 239.255.255.250.1900: UDP, length 125
09:18:58.606426 IP 192.168.20.63.138 > 192.168.20.255.138: NBT UDP PACKET(138)
09:18:58.727548 IP 192.168.20.77.5353 > 224.0.0.251.5353: 4 [2q] PTR (QM)? _CC32E753._sub._googlecast._tcp.local. PTR (QM)? _googlecast._tcp.local. (61)
09:18:58.822806 IP 192.168.20.77.39232 > 224.0.0.251.5353: 0 PTR (QU)? _spotify-connect._tcp.local. (45)
09:18:58.824187 IP 192.168.20.77.49191 > 239.255.255.250.1900: UDP, length 125
09:19:00.823196 IP 192.168.20.77.39232 > 224.0.0.251.5353: 0 PTR (QU)? _spotify-connect._tcp.local. (45)
09:19:00.823724 IP 192.168.20.77.49191 > 239.255.255.250.1900: UDP, length 125
09:19:01.661687 IP 192.168.20.74.5353 > 224.0.0.251.5353: 0 [2q] [1au] PTR (QU)? _homekit._tcp.local. PTR (QU)? _sleep-proxy._udp.local. (90)
09:19:02.452890 IP 192.168.20.74 > 224.0.0.22: igmp v3 report, 1 group record(s)
09:19:02.668975 IP 192.168.20.74.5353 > 224.0.0.251.5353: 0 [2q] [1au] PTR (QM)? _homekit._tcp.local. PTR (QM)? _sleep-proxy._udp.local. (90)
09:19:02.822951 IP 192.168.20.77.39232 > 224.0.0.251.5353: 0 PTR (QU)? _spotify-connect._tcp.local. (45)
09:19:02.824622 IP 192.168.20.77.49191 > 239.255.255.250.1900: UDP, length 125
09:19:03.498238 IP 192.168.20.74 > 224.0.0.22: igmp v3 report, 1 group record(s)
09:19:04.822219 IP 192.168.20.77.39232 > 224.0.0.251.5353: 0 PTR (QU)? _spotify-connect._tcp.local. (45)
09:19:04.823175 IP 192.168.20.77.49191 > 239.255.255.250.1900: UDP, length 125
09:19:05.674611 IP 192.168.20.74.5353 > 224.0.0.251.5353: 0 [2q] [1au] PTR (QM)? _homekit._tcp.local. PTR (QM)? _sleep-proxy._udp.local. (90)
09:19:06.576806 IP 192.168.20.77.57621 > 255.255.255.255.57621: UDP, length 40
09:19:06.832460 IP 192.168.20.77.39232 > 224.0.0.251.5353: 0 PTR (QU)? _spotify-connect._tcp.local. (45)
09:19:06.834462 IP 192.168.20.77.49191 > 239.255.255.250.1900: UDP, length 125
09:19:07.897463 IP 192.168.20.60.5355 > 224.0.0.252.5355: UDP, length 23
09:19:08.830600 IP 192.168.20.77.39232 > 224.0.0.251.5353: 0 PTR (QU)? _spotify-connect._tcp.local. (45)
09:19:08.831202 IP 192.168.20.77.49191 > 239.255.255.250.1900: UDP, length 125
09:19:10.835677 IP 192.168.20.77.49191 > 239.255.255.250.1900: UDP, length 125
09:19:10.835688 IP 192.168.20.77.39232 > 224.0.0.251.5353: 0 PTR (QU)? _spotify-connect._tcp.local. (45)
09:19:12.834058 IP 192.168.20.77.49191 > 239.255.255.250.1900: UDP, length 125
09:19:12.834070 IP 192.168.20.77.39232 > 224.0.0.251.5353: 0 PTR (QU)? _spotify-connect._tcp.local. (45)
09:19:13.420797 IP 192.168.20.74.5353 > 224.0.0.251.5353: 0 [2q] [1au] PTR (QU)? _homekit._tcp.local. PTR (QU)? _sleep-proxy._udp.local. (90)
09:19:14.872311 IP 192.168.20.77.49191 > 239.255.255.250.1900: UDP, length 125
09:19:14.872321 IP 192.168.20.77.39232 > 224.0.0.251.5353: 0 PTR (QU)? _spotify-connect._tcp.local. (45)
09:19:16.833515 IP 192.168.20.77.49191 > 239.255.255.250.1900: UDP, length 125
09:19:16.833529 IP 192.168.20.77.39232 > 224.0.0.251.5353: 0 PTR (QU)? _spotify-connect._tcp.local. (45)
09:19:17.491838 IP 192.168.20.74.5353 > 224.0.0.251.5353: 0 [2q] [1au] PTR (QM)? _homekit._tcp.local. PTR (QM)? _sleep-proxy._udp.local. (90)
09:19:18.730012 IP 192.168.20.77.5353 > 224.0.0.251.5353: 5 [2q] PTR (QM)? _CC32E753._sub._googlecast._tcp.local. PTR (QM)? _googlecast._tcp.local. (61)
09:19:18.831392 IP 192.168.20.77.49191 > 239.255.255.250.1900: UDP, length 125
09:19:18.831405 IP 192.168.20.77.39232 > 224.0.0.251.5353: 0 PTR (QU)? _spotify-connect._tcp.local. (45)
09:19:20.834820 IP 192.168.20.77.49191 > 239.255.255.250.1900: UDP, length 125
09:19:20.835742 IP 192.168.20.77.39232 > 224.0.0.251.5353: 0 PTR (QU)? _spotify-connect._tcp.local. (45)
09:19:22.836107 IP 192.168.20.77.49191 > 239.255.255.250.1900: UDP, length 125
09:19:22.836121 IP 192.168.20.77.39232 > 224.0.0.251.5353: 0 PTR (QU)? _spotify-connect._tcp.local. (45)
09:19:24.838509 IP 192.168.20.77.49191 > 239.255.255.250.1900: UDP, length 125
09:19:24.838522 IP 192.168.20.77.39232 > 224.0.0.251.5353: 0 PTR (QU)? _spotify-connect._tcp.local. (45)
09:19:26.834592 IP 192.168.20.77.49191 > 239.255.255.250.1900: UDP, length 125
09:19:26.834605 IP 192.168.20.77.39232 > 224.0.0.251.5353: 0 PTR (QU)? _spotify-connect._tcp.local. (45)
09:19:28.834257 IP 192.168.20.77.49191 > 239.255.255.250.1900: UDP, length 125
09:19:28.834269 IP 192.168.20.77.39232 > 224.0.0.251.5353: 0 PTR (QU)? _spotify-connect._tcp.local. (45)
09:19:30.838545 IP 192.168.20.77.49191 > 239.255.255.250.1900: UDP, length 125
09:19:30.838557 IP 192.168.20.77.39232 > 224.0.0.251.5353: 0 PTR (QU)? _spotify-connect._tcp.local. (45)
09:19:32.838246 IP 192.168.20.77.39232 > 224.0.0.251.5353: 0 PTR (QU)? _spotify-connect._tcp.local. (45)
09:19:32.839680 IP 192.168.20.77.49191 > 239.255.255.250.1900: UDP, length 125
09:19:34.841192 IP 192.168.20.77.49191 > 239.255.255.250.1900: UDP, length 125
09:19:34.841204 IP 192.168.20.77.39232 > 224.0.0.251.5353: 0 PTR (QU)? _spotify-connect._tcp.local. (45)
09:19:36.577011 IP 192.168.20.77.57621 > 255.255.255.255.57621: UDP, length 40
09:19:38.732311 IP 192.168.20.77.5353 > 224.0.0.251.5353: 6 [2q] PTR (QM)? _CC32E753._sub._googlecast._tcp.local. PTR (QM)? _googlecast._tcp.local. (61)
09:19:44.275645 IP 192.168.20.54.5353 > 224.0.0.251.5353: 0 [1a] [9q] PTR (QM)? _nfs._tcp.local. PTR (QM)? _ipp._tcp.local. PTR (QM)? _ipps._tcp.local. PTR (QM)? _ftp._tcp.local. PTR (QM)? _webdav._tcp.local. PTR (QM)? _webdavs._tcp.local. PTR (QM)? _sftp-ssh._tcp.local. PTR (QM)? _smb._tcp.local. PTR (QM)? _afpovertcp._tcp.local. (161)
09:19:45.596017 IP 192.168.20.65.47469 > 239.255.255.250.1900: UDP, length 167
09:19:46.597279 IP 192.168.20.65.47469 > 239.255.255.250.1900: UDP, length 167
09:19:47.598492 IP 192.168.20.65.47469 > 239.255.255.250.1900: UDP, length 167
09:19:48.599809 IP 192.168.20.65.47469 > 239.255.255.250.1900: UDP, length 167
09:19:54.310242 IP 192.168.20.63.137 > 192.168.20.255.137: NBT UDP PACKET(137): QUERY; REQUEST; BROADCAST
09:19:55.060348 IP 192.168.20.63.137 > 192.168.20.255.137: NBT UDP PACKET(137): QUERY; REQUEST; BROADCAST
09:19:55.810364 IP 192.168.20.63.137 > 192.168.20.255.137: NBT UDP PACKET(137): QUERY; REQUEST; BROADCAST
09:20:06.575780 IP 192.168.20.77.57621 > 255.255.255.255.57621: UDP, length 40
09:20:41.858198 IP 192.168.20.63.64569 > 239.255.255.250.1900: UDP, length 174
09:20:42.859377 IP 192.168.20.63.64569 > 239.255.255.250.1900: UDP, length 174
09:20:43.860025 IP 192.168.20.63.64569 > 239.255.255.250.1900: UDP, length 174
09:20:44.862419 IP 192.168.20.63.64569 > 239.255.255.250.1900: UDP, length 174
09:20:48.422119 IP 192.168.20.250 > 224.0.0.1: igmp query v3
09:20:48.601297 IP 192.168.20.52 > 224.0.0.22: igmp v3 report, 2 group record(s)
09:20:49.176737 IP 192.168.20.65 > 224.0.0.22: igmp v3 report, 2 group record(s)
09:20:49.314114 IP 192.168.20.63 > 224.0.0.22: igmp v3 report, 1 group record(s)
09:20:49.737418 IP 192.168.20.56 > 224.0.0.22: igmp v3 report, 2 group record(s)
09:20:50.180724 IP 192.168.20.54 > 224.0.0.22: igmp v3 report, 2 group record(s)
09:20:50.650601 IP 192.168.20.44 > 224.0.0.22: igmp v3 report, 1 group record(s)
09:20:50.779912 IP 192.168.20.55 > 224.0.0.22: igmp v3 report, 2 group record(s)
09:20:50.814763 IP 192.168.20.63 > 224.0.0.22: igmp v3 report, 1 group record(s)
09:20:51.086438 IP 192.168.20.66 > 224.0.0.22: igmp v3 report, 2 group record(s)
09:20:51.148794 IP 192.168.20.60 > 224.0.0.22: igmp v3 report, 2 group record(s)
09:20:51.314578 IP 192.168.20.63 > 224.0.0.22: igmp v3 report, 1 group record(s)
09:20:52.650646 IP 192.168.20.44 > 224.0.0.22: igmp v3 report, 1 group record(s)
09:20:53.127512 IP 192.168.20.51 > 224.0.0.22: igmp v3 report, 2 group record(s)
09:20:53.369380 IP 192.168.20.79 > 224.0.0.22: igmp v3 report, 1 group record(s)
09:20:55.369705 IP 192.168.20.79 > 224.0.0.22: igmp v3 report, 1 group record(s)
09:20:55.469422 IP 192.168.20.77 > 224.0.0.22: igmp v3 report, 3 group record(s)
09:20:57.150025 IP 192.168.20.44 > 224.0.0.22: igmp v3 report, 1 group record(s)
09:20:57.945176 IP 192.168.20.62 > 224.0.0.22: igmp v3 report, 2 group record(s)
09:21:01.043961 IP 192.168.20.62.5353 > 224.0.0.251.5353: 0 [1a] [9q] PTR (QM)? _nfs._tcp.local. PTR (QM)? _ipp._tcp.local. PTR (QM)? _ipps._tcp.local. PTR (QM)? _ftp._tcp.local. PTR (QM)? _webdav._tcp.local. PTR (QM)? _webdavs._tcp.local. PTR (QM)? _sftp-ssh._tcp.local. PTR (QM)? _smb._tcp.local. PTR (QM)? _afpovertcp._tcp.local. (161)
09:21:03.068456 IP 192.168.20.77.57621 > 255.255.255.255.57621: UDP, length 40
09:21:13.385541 IP 192.168.20.74.5353 > 224.0.0.251.5353: 0 [2q] [1au] PTR (QU)? _homekit._tcp.local. PTR (QU)? _sleep-proxy._udp.local. (90)
09:21:14.112004 IP 192.168.20.74 > 224.0.0.22: igmp v3 report, 1 group record(s)
09:21:14.403526 IP 192.168.20.74.5353 > 224.0.0.251.5353: 0 [2q] [1au] PTR (QM)? _homekit._tcp.local. PTR (QM)? _sleep-proxy._udp.local. (90)
09:21:15.208770 IP 192.168.20.74 > 224.0.0.22: igmp v3 report, 1 group record(s)
09:21:17.402461 IP 192.168.20.74.5353 > 224.0.0.251.5353: 0 [2q] [1au] PTR (QM)? _homekit._tcp.local. PTR (QM)? _sleep-proxy._udp.local. (90)
09:21:26.423756 IP 192.168.20.74.5353 > 224.0.0.251.5353: 0 [2q] [1au] PTR (QM)? _homekit._tcp.local. PTR (QM)? _sleep-proxy._udp.local. (90)
09:21:33.069087 IP 192.168.20.77.57621 > 255.255.255.255.57621: UDP, length 40
09:21:45.596779 IP 192.168.20.65.59417 > 239.255.255.250.1900: UDP, length 167
09:21:46.598284 IP 192.168.20.65.59417 > 239.255.255.250.1900: UDP, length 167
09:21:47.599535 IP 192.168.20.65.59417 > 239.255.255.250.1900: UDP, length 167
09:21:48.600800 IP 192.168.20.65.59417 > 239.255.255.250.1900: UDP, length 167
09:21:55.917024 IP 192.168.20.60.138 > 192.168.20.255.138: NBT UDP PACKET(138)
09:21:55.917038 IP 192.168.20.60.138 > 192.168.20.255.138: NBT UDP PACKET(138)
09:22:01.403640 IP 192.168.20.77.49191 > 239.255.255.250.1900: UDP, length 125
09:22:03.073605 IP 192.168.20.77.57621 > 255.255.255.255.57621: UDP, length 40
09:22:08.683391 IP 192.168.20.250.137 > 192.168.20.255.137: NBT UDP PACKET(137): QUERY; REQUEST; BROADCAST
09:22:09.433425 IP 192.168.20.250.137 > 192.168.20.255.137: NBT UDP PACKET(137): QUERY; REQUEST; BROADCAST
09:22:10.197763 IP 192.168.20.250.137 > 192.168.20.255.137: NBT UDP PACKET(137): QUERY; REQUEST; BROADCAST
09:22:13.882135 IP 192.168.20.250.68 > 255.255.255.255.67: BOOTP/DHCP, Request from 00:00:00:00:00:00, length 248
09:22:13.883745 IP 192.168.20.250.67 > 255.255.255.255.68: BOOTP/DHCP, Reply, length 300
09:22:13.883764 IP 192.168.20.250.68 > 255.255.255.255.67: BOOTP/DHCP, Request from 00:00:00:00:00:00, length 248
09:22:15.892186 IP 192.168.20.250.68 > 255.255.255.255.67: BOOTP/DHCP, Request from 00:00:00:00:00:00, length 248
09:22:15.892558 IP 192.168.20.250.67 > 255.255.255.255.68: BOOTP/DHCP, Reply, length 300
09:22:17.904576 IP 192.168.20.250.68 > 255.255.255.255.67: BOOTP/DHCP, Request from 00:00:00:00:00:00, length 248
09:22:17.904911 IP 192.168.20.250.67 > 255.255.255.255.68: BOOTP/DHCP, Reply, length 300
09:22:20.916729 IP 192.168.20.44.138 > 192.168.20.255.138: NBT UDP PACKET(138)
09:22:26.307574 IP 192.168.20.44.56144 > 239.255.255.250.1900: UDP, length 125
09:22:26.308308 IP 192.168.20.44.56144 > 239.255.255.250.1900: UDP, length 123
09:22:29.307779 IP 192.168.20.44.56144 > 239.255.255.250.1900: UDP, length 125
09:22:29.308646 IP 192.168.20.44.56144 > 239.255.255.250.1900: UDP, length 123
09:22:32.307905 IP 192.168.20.44.56144 > 239.255.255.250.1900: UDP, length 125
09:22:32.308817 IP 192.168.20.44.56144 > 239.255.255.250.1900: UDP, length 123
09:22:33.075524 IP 192.168.20.77.57621 > 255.255.255.255.57621: UDP, length 40
09:22:41.874515 IP 192.168.20.63.57310 > 239.255.255.250.1900: UDP, length 174
09:22:42.875919 IP 192.168.20.63.57310 > 239.255.255.250.1900: UDP, length 174
09:22:43.879716 IP 192.168.20.63.57310 > 239.255.255.250.1900: UDP, length 174
09:22:44.885085 IP 192.168.20.63.57310 > 239.255.255.250.1900: UDP, length 174
09:22:53.426103 IP 192.168.20.250 > 224.0.0.1: igmp query v3
09:22:53.650843 IP 192.168.20.44 > 224.0.0.22: igmp v3 report, 1 group record(s)
09:22:54.650829 IP 192.168.20.44 > 224.0.0.22: igmp v3 report, 1 group record(s)
09:22:54.823268 IP 192.168.20.54 > 224.0.0.22: igmp v3 report, 2 group record(s)
09:22:54.826466 IP 192.168.20.63 > 224.0.0.22: igmp v3 report, 1 group record(s)
09:22:55.288683 IP 192.168.20.62 > 224.0.0.22: igmp v3 report, 2 group record(s)
09:22:55.384250 IP 192.168.20.65 > 224.0.0.22: igmp v3 report, 2 group record(s)
09:22:56.401077 IP 192.168.20.52 > 224.0.0.22: igmp v3 report, 2 group record(s)
09:22:56.650956 IP 192.168.20.44 > 224.0.0.22: igmp v3 report, 1 group record(s)
09:22:57.225395 IP 192.168.20.56 > 224.0.0.22: igmp v3 report, 2 group record(s)
09:22:57.287107 IP 192.168.20.51 > 224.0.0.22: igmp v3 report, 2 group record(s)
09:22:57.333670 IP 192.168.20.63 > 224.0.0.22: igmp v3 report, 1 group record(s)
09:22:57.559286 IP 192.168.20.44 > 224.0.0.22: igmp v3 report, 1 group record(s)
09:22:57.568023 IP 192.168.20.44 > 224.0.0.22: igmp v3 report, 1 group record(s)
09:22:57.568665 IP 192.168.20.44 > 224.0.0.22: igmp v3 report, 1 group record(s)
09:22:57.576439 IP 192.168.20.44 > 224.0.0.22: igmp v3 report, 1 group record(s)
09:22:57.581077 IP 192.168.20.44.53084 > 224.0.0.252.5355: UDP, length 27
09:22:57.651026 IP 192.168.20.44 > 224.0.0.22: igmp v3 report, 1 group record(s)
09:22:57.681143 IP 192.168.20.44.53084 > 224.0.0.252.5355: UDP, length 27
09:22:57.836333 IP 192.168.20.44.56144 > 239.255.255.250.1900: UDP, length 133
09:22:59.548637 IP 192.168.20.55 > 224.0.0.22: igmp v3 report, 2 group record(s)
09:23:00.328345 IP 192.168.20.63 > 224.0.0.22: igmp v3 report, 1 group record(s)
09:23:00.359652 IP 192.168.20.79 > 224.0.0.22: igmp v3 report, 1 group record(s)
09:23:00.366166 IP 192.168.20.66 > 224.0.0.22: igmp v3 report, 2 group record(s)
09:23:00.836425 IP 192.168.20.44.56144 > 239.255.255.250.1900: UDP, length 133
09:23:02.361904 IP 192.168.20.79 > 224.0.0.22: igmp v3 report, 2 group record(s)
09:23:03.244895 IP 192.168.20.60 > 224.0.0.22: igmp v3 report, 2 group record(s)
09:23:03.836644 IP 192.168.20.44.56144 > 239.255.255.250.1900: UDP, length 133
09:23:06.850420 IP 192.168.20.44.56144 > 239.255.255.250.1900: UDP, length 133
09:23:09.616119 IP 192.168.20.77.57621 > 255.255.255.255.57621: UDP, length 40
09:23:09.849992 IP 192.168.20.44.56144 > 239.255.255.250.1900: UDP, length 133
09:23:12.850217 IP 192.168.20.44.56144 > 239.255.255.250.1900: UDP, length 133
09:23:39.610026 IP 192.168.20.77.57621 > 255.255.255.255.57621: UDP, length 40
09:23:45.596916 IP 192.168.20.65.43796 > 239.255.255.250.1900: UDP, length 167
09:23:46.598587 IP 192.168.20.65.43796 > 239.255.255.250.1900: UDP, length 167
09:23:47.599794 IP 192.168.20.65.43796 > 239.255.255.250.1900: UDP, length 167
09:23:48.601074 IP 192.168.20.65.43796 > 239.255.255.250.1900: UDP, length 167
09:23:59.809991 IP 192.168.20.74.5353 > 224.0.0.251.5353: 0 [2q] [1au] PTR (QU)? _homekit._tcp.local. PTR (QU)? _sleep-proxy._udp.local. (90)
09:24:00.817620 IP 192.168.20.74.5353 > 224.0.0.251.5353: 0 [2q] [1au] PTR (QM)? _homekit._tcp.local. PTR (QM)? _sleep-proxy._udp.local. (90)
09:24:03.828694 IP 192.168.20.74.5353 > 224.0.0.251.5353: 0 [2q] [1au] PTR (QM)? _homekit._tcp.local. PTR (QM)? _sleep-proxy._udp.local. (90)
09:24:07.875765 IP 192.168.20.77.49191 > 239.255.255.250.1900: UDP, length 125
09:24:09.615518 IP 192.168.20.77.57621 > 255.255.255.255.57621: UDP, length 40
09:24:39.516915 IP 192.168.20.63.55395 > 224.0.0.252.5355: UDP, length 26
09:24:39.616790 IP 192.168.20.77.57621 > 255.255.255.255.57621: UDP, length 40
09:24:39.618837 IP 192.168.20.63.55395 > 224.0.0.252.5355: UDP, length 26
09:24:39.821920 IP 192.168.20.63.137 > 192.168.20.255.137: NBT UDP PACKET(137): QUERY; REQUEST; BROADCAST
09:24:40.580792 IP 192.168.20.63.137 > 192.168.20.255.137: NBT UDP PACKET(137): QUERY; REQUEST; BROADCAST
09:24:41.331652 IP 192.168.20.63.137 > 192.168.20.255.137: NBT UDP PACKET(137): QUERY; REQUEST; BROADCAST
09:24:41.881934 IP 192.168.20.63.55396 > 239.255.255.250.1900: UDP, length 174
09:24:42.884297 IP 192.168.20.63.55396 > 239.255.255.250.1900: UDP, length 174
09:24:43.891678 IP 192.168.20.63.55396 > 239.255.255.250.1900: UDP, length 174
09:24:44.895508 IP 192.168.20.63.55396 > 239.255.255.250.1900: UDP, length 174
09:24:51.436585 IP 192.168.20.74.5353 > 224.0.0.251.5353: 0 [2q] [1au] PTR (QU)? _homekit._tcp.local. PTR (QU)? _sleep-proxy._udp.local. (90)
09:24:52.149251 IP 192.168.20.74 > 224.0.0.22: igmp v3 report, 1 group record(s)
09:24:52.444428 IP 192.168.20.74.5353 > 224.0.0.251.5353: 0 [2q] [1au] PTR (QM)? _homekit._tcp.local. PTR (QM)? _sleep-proxy._udp.local. (90)
09:24:54.151328 IP 192.168.20.74 > 224.0.0.22: igmp v3 report, 1 group record(s)
09:24:55.451844 IP 192.168.20.74.5353 > 224.0.0.251.5353: 0 [2q] [1au] PTR (QM)? _homekit._tcp.local. PTR (QM)? _sleep-proxy._udp.local. (90)
09:24:58.429797 IP 192.168.20.250 > 224.0.0.1: igmp query v3
09:24:58.872297 IP 192.168.20.62 > 224.0.0.22: igmp v3 report, 2 group record(s)
09:24:59.830927 IP 192.168.20.63 > 224.0.0.22: igmp v3 report, 1 group record(s)
09:25:00.203758 IP 192.168.20.77 > 224.0.0.22: igmp v3 report, 3 group record(s)
09:25:00.637174 IP 192.168.20.55 > 224.0.0.22: igmp v3 report, 2 group record(s)
09:25:01.385577 IP 192.168.20.54 > 224.0.0.22: igmp v3 report, 2 group record(s)
09:25:02.493784 IP 192.168.20.74 > 224.0.0.22: igmp v3 report, 1 group record(s)
09:25:03.150268 IP 192.168.20.44 > 224.0.0.22: igmp v3 report, 1 group record(s)
09:25:03.358812 IP 192.168.20.79 > 224.0.0.22: igmp v3 report, 1 group record(s)
09:25:03.945266 IP 192.168.20.56 > 224.0.0.22: igmp v3 report, 2 group record(s)
09:25:04.262764 IP 192.168.20.51 > 224.0.0.22: igmp v3 report, 2 group record(s)
09:25:04.358126 IP 192.168.20.79 > 224.0.0.22: igmp v3 report, 1 group record(s)
09:25:04.472704 IP 192.168.20.74.5353 > 224.0.0.251.5353: 0 [2q] [1au] PTR (QM)? _homekit._tcp.local. PTR (QM)? _sleep-proxy._udp.local. (90)
09:25:04.791699 IP 192.168.20.65 > 224.0.0.22: igmp v3 report, 2 group record(s)
09:25:04.827124 IP 192.168.20.63 > 224.0.0.22: igmp v3 report, 1 group record(s)
09:25:04.858289 IP 192.168.20.79 > 224.0.0.22: igmp v3 report, 1 group record(s)
09:25:05.100040 IP 192.168.20.60 > 224.0.0.22: igmp v3 report, 2 group record(s)
09:25:05.327130 IP 192.168.20.63 > 224.0.0.22: igmp v3 report, 1 group record(s)
09:25:05.650366 IP 192.168.20.44 > 224.0.0.22: igmp v3 report, 1 group record(s)
09:25:07.150446 IP 192.168.20.44 > 224.0.0.22: igmp v3 report, 1 group record(s)
09:25:07.597793 IP 192.168.20.66 > 224.0.0.22: igmp v3 report, 2 group record(s)
09:25:07.984701 IP 192.168.20.52 > 224.0.0.22: igmp v3 report, 2 group record(s)
09:25:09.617285 IP 192.168.20.77.57621 > 255.255.255.255.57621: UDP, length 40
09:25:19.397824 IP 192.168.20.77 > 224.0.0.22: igmp v3 report, 2 group record(s)
09:25:20.213831 IP 192.168.20.77 > 224.0.0.22: igmp v3 report, 2 group record(s)
09:25:42.122331 IP 192.168.20.74.5353 > 224.0.0.251.5353: 0 [2q] [1au] PTR (QU)? _homekit._tcp.local. PTR (QU)? _sleep-proxy._udp.local. (90)
09:25:43.132370 IP 192.168.20.74.5353 > 224.0.0.251.5353: 0 [2q] [1au] PTR (QM)? _homekit._tcp.local. PTR (QM)? _sleep-proxy._udp.local. (90)
09:25:45.597656 IP 192.168.20.65.36017 > 239.255.255.250.1900: UDP, length 167
09:25:46.141572 IP 192.168.20.74.5353 > 224.0.0.251.5353: 0 [2q] [1au] PTR (QM)? _homekit._tcp.local. PTR (QM)? _sleep-proxy._udp.local. (90)
09:25:46.598603 IP 192.168.20.65.36017 > 239.255.255.250.1900: UDP, length 167
09:25:47.600419 IP 192.168.20.65.36017 > 239.255.255.250.1900: UDP, length 167
09:25:48.601637 IP 192.168.20.65.36017 > 239.255.255.250.1900: UDP, length 167
09:26:41.889784 IP 192.168.20.63.61521 > 239.255.255.250.1900: UDP, length 174
09:26:42.904176 IP 192.168.20.63.61521 > 239.255.255.250.1900: UDP, length 174
09:26:43.912405 IP 192.168.20.63.61521 > 239.255.255.250.1900: UDP, length 174
09:26:44.914810 IP 192.168.20.63.61521 > 239.255.255.250.1900: UDP, length 174
09:27:03.433666 IP 192.168.20.250 > 224.0.0.1: igmp query v3
09:27:03.857205 IP 192.168.20.79 > 224.0.0.22: igmp v3 report, 1 group record(s)
09:27:05.650350 IP 192.168.20.44 > 224.0.0.22: igmp v3 report, 1 group record(s)
09:27:06.700038 IP 192.168.20.60 > 224.0.0.22: igmp v3 report, 2 group record(s)
09:27:06.834242 IP 192.168.20.63 > 224.0.0.22: igmp v3 report, 1 group record(s)
09:27:07.149470 IP 192.168.20.66 > 224.0.0.22: igmp v3 report, 2 group record(s)
09:27:07.849260 IP 192.168.20.56 > 224.0.0.22: igmp v3 report, 2 group record(s)
09:27:07.855490 IP 192.168.20.79 > 224.0.0.22: igmp v3 report, 1 group record(s)
09:27:07.864230 IP 192.168.20.62 > 224.0.0.22: igmp v3 report, 2 group record(s)
09:27:08.337655 IP 192.168.20.63 > 224.0.0.22: igmp v3 report, 1 group record(s)
09:27:08.560400 IP 192.168.20.52 > 224.0.0.22: igmp v3 report, 2 group record(s)
09:27:08.840246 IP 192.168.20.63 > 224.0.0.22: igmp v3 report, 1 group record(s)
09:27:09.975285 IP 192.168.20.65 > 224.0.0.22: igmp v3 report, 2 group record(s)
09:27:10.150529 IP 192.168.20.44 > 224.0.0.22: igmp v3 report, 1 group record(s)
09:27:10.214557 IP 192.168.20.51 > 224.0.0.22: igmp v3 report, 2 group record(s)
09:27:10.650561 IP 192.168.20.44 > 224.0.0.22: igmp v3 report, 1 group record(s)
09:27:10.667877 IP 192.168.20.54 > 224.0.0.22: igmp v3 report, 2 group record(s)
09:27:10.855528 IP 192.168.20.79 > 224.0.0.22: igmp v3 report, 1 group record(s)
09:27:12.477814 IP 192.168.20.55 > 224.0.0.22: igmp v3 report, 2 group record(s)
09:27:14.974163 IP 192.168.20.63.138 > 192.168.20.255.138: NBT UDP PACKET(138)
09:27:20.674033 IP 192.168.20.79.138 > 192.168.20.255.138: NBT UDP PACKET(138)
09:27:21.254947 IP 192.168.20.63.68 > 255.255.255.255.67: BOOTP/DHCP, Request from 4c:cc:6a:3a:3f:14, length 300
09:27:21.255796 IP 192.168.20.250.67 > 255.255.255.255.68: BOOTP/DHCP, Reply, length 300
09:27:45.597762 IP 192.168.20.65.59530 > 239.255.255.250.1900: UDP, length 167
09:27:46.599283 IP 192.168.20.65.59530 > 239.255.255.250.1900: UDP, length 167
09:27:47.600533 IP 192.168.20.65.59530 > 239.255.255.250.1900: UDP, length 167
09:27:48.601778 IP 192.168.20.65.59530 > 239.255.255.250.1900: UDP, length 167
09:28:37.147957 IP 192.168.20.250.138 > 192.168.20.255.138: NBT UDP PACKET(138)
09:28:41.895254 IP 192.168.20.63.51078 > 239.255.255.250.1900: UDP, length 174
09:28:42.896222 IP 192.168.20.63.51078 > 239.255.255.250.1900: UDP, length 174
09:28:43.896316 IP 192.168.20.63.51078 > 239.255.255.250.1900: UDP, length 174
09:28:44.896407 IP 192.168.20.63.51078 > 239.255.255.250.1900: UDP, length 174
09:29:00.567713 IP 192.168.20.74.5353 > 224.0.0.251.5353: 0 [2q] [1au] PTR (QU)? _homekit._tcp.local. PTR (QU)? _sleep-proxy._udp.local. (90)
09:29:01.450937 IP 192.168.20.74 > 224.0.0.22: igmp v3 report, 1 group record(s)
09:29:01.575375 IP 192.168.20.74.5353 > 224.0.0.251.5353: 0 [2q] [1au] PTR (QM)? _homekit._tcp.local. PTR (QM)? _sleep-proxy._udp.local. (90)
09:29:01.838311 IP 192.168.20.79 > 224.0.0.22: igmp v3 report, 1 group record(s)
09:29:01.839754 IP 192.168.20.79 > 224.0.0.22: igmp v3 report, 1 group record(s)
09:29:01.854063 IP 192.168.20.79 > 224.0.0.22: igmp v3 report, 2 group record(s)
09:29:01.857936 IP 192.168.20.79 > 224.0.0.22: igmp v3 report, 1 group record(s)
09:29:01.858347 IP 192.168.20.79 > 224.0.0.22: igmp v3 report, 1 group record(s)
09:29:01.858942 IP 192.168.20.79.55484 > 224.0.0.252.5355: UDP, length 24
09:29:01.859895 IP 192.168.20.79 > 224.0.0.22: igmp v3 report, 1 group record(s)
09:29:01.863988 IP 192.168.20.79 > 224.0.0.22: igmp v3 report, 1 group record(s)
09:29:01.926817 IP 192.168.20.79 > 224.0.0.22: igmp v3 report, 1 group record(s)
09:29:01.926955 IP 192.168.20.79 > 224.0.0.22: igmp v3 report, 1 group record(s)
09:29:02.273365 IP 192.168.20.79.55484 > 224.0.0.252.5355: UDP, length 24
09:29:02.353316 IP 192.168.20.79 > 224.0.0.22: igmp v3 report, 2 group record(s)
09:29:02.361059 IP 192.168.20.79 > 224.0.0.22: igmp v3 report, 1 group record(s)
09:29:02.372825 IP 192.168.20.79 > 224.0.0.22: igmp v3 report, 1 group record(s)
09:29:02.518211 IP 192.168.20.74 > 224.0.0.22: igmp v3 report, 1 group record(s)
09:29:02.681609 IP 192.168.20.79 > 224.0.0.22: igmp v3 report, 1 group record(s)
09:29:02.681975 IP 192.168.20.79 > 224.0.0.22: igmp v3 report, 1 group record(s)
09:29:02.682628 IP 192.168.20.79.52762 > 224.0.0.252.5355: UDP, length 24
09:29:02.853316 IP 192.168.20.79 > 224.0.0.22: igmp v3 report, 2 group record(s)
09:29:03.093454 IP 192.168.20.79.52762 > 224.0.0.252.5355: UDP, length 24
09:29:04.585213 IP 192.168.20.74.5353 > 224.0.0.251.5353: 0 [2q] [1au] PTR (QM)? _homekit._tcp.local. PTR (QM)? _sleep-proxy._udp.local. (90)
09:29:08.437590 IP 192.168.20.250 > 224.0.0.1: igmp query v3
09:29:09.094504 IP 192.168.20.51 > 224.0.0.22: igmp v3 report, 2 group record(s)
09:29:09.488102 IP 192.168.20.52 > 224.0.0.22: igmp v3 report, 2 group record(s)
09:29:10.353969 IP 192.168.20.79 > 224.0.0.22: igmp v3 report, 1 group record(s)
09:29:11.150582 IP 192.168.20.44 > 224.0.0.22: igmp v3 report, 1 group record(s)
09:29:11.309113 IP 192.168.20.66 > 224.0.0.22: igmp v3 report, 2 group record(s)
09:29:12.150608 IP 192.168.20.44 > 224.0.0.22: igmp v3 report, 1 group record(s)
09:29:12.598990 IP 192.168.20.65 > 224.0.0.22: igmp v3 report, 2 group record(s)
09:29:12.792153 IP 192.168.20.62 > 224.0.0.22: igmp v3 report, 2 group record(s)
09:29:13.566444 IP 192.168.20.55 > 224.0.0.22: igmp v3 report, 2 group record(s)
09:29:13.839284 IP 192.168.20.63 > 224.0.0.22: igmp v3 report, 1 group record(s)
09:29:14.313325 IP 192.168.20.56 > 224.0.0.22: igmp v3 report, 2 group record(s)
09:29:14.650717 IP 192.168.20.44 > 224.0.0.22: igmp v3 report, 1 group record(s)
09:29:14.701325 IP 192.168.20.60 > 224.0.0.22: igmp v3 report, 2 group record(s)
09:29:14.853150 IP 192.168.20.79 > 224.0.0.22: igmp v3 report, 1 group record(s)
09:29:15.839310 IP 192.168.20.63 > 224.0.0.22: igmp v3 report, 1 group record(s)
09:29:17.381790 IP 192.168.20.54 > 224.0.0.22: igmp v3 report, 2 group record(s)
09:29:17.839492 IP 192.168.20.63 > 224.0.0.22: igmp v3 report, 1 group record(s)
09:29:17.853675 IP 192.168.20.79 > 224.0.0.22: igmp v3 report, 1 group record(s)
09:29:45.598692 IP 192.168.20.65.58032 > 239.255.255.250.1900: UDP, length 167
09:29:46.600039 IP 192.168.20.65.58032 > 239.255.255.250.1900: UDP, length 167
09:29:47.601336 IP 192.168.20.65.58032 > 239.255.255.250.1900: UDP, length 167
09:29:48.602569 IP 192.168.20.65.58032 > 239.255.255.250.1900: UDP, length 167
